start,duration,text,valence,arousal
1379.35,2.699,telling that tum tum pick the name tum,0,0
1380.88,3.63,tum how do you pick it,0,0
1382.049,4.35,what do you do I mean I was walking next,0,0
1384.51,4.95,to him and I said hey what's up he said,0,0
1386.399,4.351,I said what was your name Tom times I,0,0
1389.46,6.179,tell them to I'm like oh cool,0,0
1390.75,8.639,oh my perception against it hmm I got a,0,0
1395.639,7.951,11 yeah all right well instead at home,0,0
1399.389,7.741,Tom yeah it's a name Tom too weird I,0,0
1403.59,5.069,guess yeah I guess they have names it's,0,0
1407.13,3.179,weird yeah me I guess everything amazed,0,0
1408.659,5.52,all right Oh go hater,0,0
1410.309,9.031,hey hey Tom Tom come over here buddy,0,0
1414.179,7.651,and it just goes in the ground and then,0,0
1419.34,5.25,up from the ground behind you and,0,0
1421.83,7.14,standing there see that thing over there,0,0
1424.59,9.03,that weird-looking thing over there,0,0
1428.97,6.69,no no see that thing over there go see,0,0
1433.62,6.3,what it wants it might try to punch you,0,0
1435.66,7.53,just put you back it goes like this code,0,0
1439.92,6.57,gray hmm we don't really want him to,0,0
1443.19,4.77,start hitting them yeah we do it just,0,0
1446.49,2.55,wants a feat of strength you want it,0,0
1447.96,3.78,wants to test us,0,0
1449.04,4.65,all right brand you got 32 inch biceps,0,0
1451.74,7.32,it's basically the same size is sometime,0,0
1453.69,7.98,yeah so all right no guys I'm gonna,0,0
1459.06,6.3,wrestle this out there cool can be your,0,0
1461.67,6.6,coach all right I'm gonna go over my sir,0,0
1465.36,5.94,I'm buckling like oh yeah I'm ugly I'm,0,0
1468.27,6.09,taking off his heavy plate armor ready,0,0
1471.3,4.68,for this get all greased up like I'm,0,0
1474.36,4.08,looking like I want to wrestle all right,0,0
1475.98,4.89,and it looks at you and now that you're,0,0
1478.44,4.83,not wearing any like glinting metal or,0,0
1480.87,5.64,anything like that it it slows its pace,0,0
1483.27,5.25,and starts to step side to side like it,0,0
1486.51,3.84,might want to attack you or something,0,0
1488.52,3.71,like that but kind of you're not sure,0,0
1490.35,4.56,what its gonna do but it's kind of,0,0
1492.23,6.06,certainly has its targets on you now,0,0
1494.91,7.44,that you disarmed okay roll perception,0,0
1498.29,6.07,with a with a 16 she's kind of see like,0,0
1502.35,5.13,what kind of style fire it might be it's,0,0
1504.36,5.31,gonna jump on you and try and like pin,0,0
1507.48,4.53,you and strangle you and knock you out,0,0
1509.67,5.25,and you got to do that first so move in,0,0
1512.01,4.68,here and keeps facing you it doesn't,0,0
1514.92,3.57,move you're gonna roll initiative and,0,1
1516.69,6.48,it's rolling initiative against you it's,0,1
1518.49,7.05,on initiative is a AEL time well you,0,1
1523.17,4.77,beat it you get the first move I'm,0,1
1525.54,3.99,moving in here and I'm gonna grab try to,0,1
1527.94,3.95,grapple and grapple them down into the,0,1
1529.53,5.34,ground here all right you're rolling,0,1
1531.89,5.28,against tens roll right now okay so I,0,1
1534.87,5.94,roll a little strength check go for it,0,1
1537.17,6.31,23 oh my god you ace it right away you,0,1
1540.81,4.59,grab it and it's grappled and what how,0,1
1543.48,4.02,come what kind of grapple this is like,0,1
1545.4,4.08,see I got him I'm moving in here last I,0,1
1547.5,3.72,go and I grab them kind of like get them,0,1
1549.48,2.34,over money just boom right down to the,0,1
1551.22,2.639,ground,0,1
1551.82,3.78,Teddy's on the ground huh yeah if you're,0,1
1553.859,3.3,holding it and this huge thing he's like,0,1
1555.6,4.139,riding on top of this thing that's four,0,1
1557.159,4.38,times of Sergeant Andy he's on the,0,1
1559.739,5.13,ground like moving trying to break free,0,1
1561.539,4.83,got hit a mine got alright I'm gonna get,0,1
1564.869,2.94,a rivet blue my arms are up around the,0,1
1566.369,2.94,neck area here trying to trying to get,0,1
1567.809,3.75,him into a submission you got it you got,0,1
1569.309,4.23,it alright it's it's turn it's doing its,0,1
1571.559,8.07,gonna try and break free rule against me,0,1
1573.539,11.52,again oh I got a nineteen you keep,0,1
1579.629,7.11,holding them down it's back to you gets,0,1
1585.059,3.21,back to your turn it's just I can't do,0,1
1586.739,3.12,anything you're holding it down it's,0,1
1588.269,2.76,your turn I'm locked in I've got him,0,1
1589.859,3.06,around the neck I've got him in a good,0,1
1591.029,6.39,place here hold on and say hey we need,0,1
1592.919,6.39,your help and it's just like this it's,0,1
1597.419,3.39,making this weird ass owl sound despite,0,1
1599.309,3.96,this huge statue it's a little weird how,0,1
1600.809,5.011,its shrieky but huge sin okey try to,0,1
1603.269,4.5,communicate with this thing yeah okay I,0,1
1605.82,4.89,cast a spell speak with animals,0,1
1607.769,4.921,yeah and through telekinesis speak to it,0,1
1610.71,3.48,and say well we've demonstrated our,0,1
1612.69,5.9,strength we need your help to save the,0,1
1614.19,7.679,woods join our cause Annika Fergus and,0,1
1618.59,5.709,it's like eyes they elicit yours and add,0,1
1621.869,4.201,Arkansas around the eyes sighs look at,0,1
1624.299,3.36,you cuz you're in telekinesis mode you,0,1
1626.07,3.419,hit you here like in a really intense,0,1
1627.659,8.85,voice it's in common you know it's,0,1
1629.489,11.91,speaking in animal here like that's I,0,1
1636.509,8.041,was getting all right brain let him up,0,1
1641.399,6.451,alright I got this round enough,1,0
1644.55,6.09,stand back fan artists mama appreciated,1,0
1647.85,6.06,yeah it would be appreciated,1,0
1650.64,4.98,brand completely oiled up and sweaty and,1,0
1653.91,4.26,almost new pops off the air I'll bear,1,0
1655.62,6.47,nalle' but stands back and steps off the,1,0
1658.17,6.96,the tubes stand apart in an uneasy truce,1,0
1662.09,6.07,and it's very clear that you bested this,1,0
1665.13,5.34,great beast of the wild and in fact I'll,1,0
1668.16,4.17,just made a game here that happened,1,0
1670.47,5.58,really fast I was expecting there to be,1,0
1672.33,5.84,a little more like rough-and-tumble but,1,0
1676.05,6.0,I'm just straight-up like completely,1,0
1678.17,6.25,shocked boom,1,0
1682.05,3.36,yeah the full ronda rousey's how about,1,0
1684.42,2.73,an opener really,1,0
1685.41,4.519,the point is it's clear the Albert,1,0
1687.15,5.79,respects your ways and it's definitely a,1,0
1689.929,4.991,temporary Ally and he's pretty huge a,1,0
1692.94,4.01,big deal it's kind of a big deal,1,0
1694.92,5.67,probably everything I've ever seen,1,0
1696.95,6.1,you've now gained another ally well we,1,0
1700.59,4.94,can only shake hands without there and,1,0
1703.05,6.18,most of all hands without you guys,1,0
1705.53,6.61,rather than turning towards the side of,1,0
1709.23,5.06,evil you have found your way in nature,1,0
1712.14,5.4,and made allies with the beasts that,1,0
1714.29,5.17,naturally reside in your land therefore,1,0
1717.54,3.66,creating a much stronger alliance than,1,0
1719.46,5.16,you could have ever had by dealing with,1,0
1721.2,5.31,those hex door cultists good practice to,1,0
1724.62,6.24,this next time the amount of time that,1,0
1726.51,8.01,it's taken to basically tame these,1,0
1730.86,5.699,beasts has eaten in to the amount of,1,0
1734.52,3.99,time you'll have to plan for the battle,1,0
1736.559,4.531,because the amount of work and effort,1,0
1738.51,4.29,required to deal with their individual,1,0
1741.09,4.08,problems and go through those respects,1,0
1742.8,4.32,rather than the easy way of just,1,0
1745.17,4.74,summoning a beast from the bull you know,1,0
1747.12,5.189,the under hell's and shit like that what,1,0
1749.91,5.28,that means is next when you find this,1,0
1752.309,5.911,army they may or may not be one step,1,0
1755.19,5.52,ahead they did good today guys thank you,1,0
1758.22,3.1,Darrien let's move in stealth and find,1,0
1760.71,2.41,that,1,0
1761.32,4.44,see what they're up to see where they,1,0
1763.12,3.299,are in the name flame oh cool I still,1,0
1765.76,2.52,speak with animals,1,0
1766.419,5.581,I asked him what his name is you hear,1,0
1768.28,7.23,him say booty hole okay who do you who,1,0
1772.0,6.87,do you who do you who and Tom Tom real,1,0
1775.51,5.82,uh notch with names with that you guys,1,0
1778.87,5.34,forging alliances with the great Hootie,1,0
1781.33,6.65,hoo and tum tum the rock beast now must,1,0
1784.21,3.77,venture forth into the oncoming battle,1,0
